{
  "documentType": "d2p:measurement-definition-registry",
  "schemaVersion": "1.0.0",
  "registryId": "org.example.other:definitions",
  "version": "1.0.0",
  "definitions": [
    {
      "definitionId": "d2p:body.chest-girth",
      "kind": "body",
      "dimension": "length",
      "unit": "mm",
      "path": {
        "type": "flat-width",
        "description": "Synthetic redefinition of the conformance kit."
      },
      "landmarks": [
        "left armpit (axilla)",
        "right armpit (axilla)",
        "shoulder blades (scapulae)"
      ],
      "posture": "d2p:standing-relaxed",
      "state": "d2p:minimal-clothing",
      "description": "A different meaning under the same definitionId (synthetic).",
      "status": "active"
    }
  ]
}
